[
  {
    "schema_version": "0.1.0",
    "id": "urn:lex-mx:federal:regulation:reg-lagra-mcdets:term:ley",
    "term": "Ley",
    "instrument_id": "urn:lex-mx:federal:regulation:reg-lagra-mcdets",
    "defining_provision_id": "urn:lex-mx:federal:regulation:reg-lagra-mcdets:article:2",
    "fraction": "I",
    "start_char": 55,
    "end_char": 80,
    "basis": "express_definition"
  },
  {
    "schema_version": "0.1.0",
    "id": "urn:lex-mx:federal:regulation:reg-lagra-mcdets:term:asamblea",
    "term": "Asamblea",
    "instrument_id": "urn:lex-mx:federal:regulation:reg-lagra-mcdets",
    "defining_provision_id": "urn:lex-mx:federal:regulation:reg-lagra-mcdets:article:2",
    "fraction": "II",
    "start_char": 80,
    "end_char": 115,
    "basis": "express_definition"
  },
  {
    "schema_version": "0.1.0",
    "id": "urn:lex-mx:federal:regulation:reg-lagra-mcdets:term:comisariado",
    "term": "Comisariado",
    "instrument_id": "urn:lex-mx:federal:regulation:reg-lagra-mcdets",
    "defining_provision_id": "urn:lex-mx:federal:regulation:reg-lagra-mcdets:article:2",
    "fraction": "III",
    "start_char": 115,
    "end_char": 157,
    "basis": "express_definition"
  },
  {
    "schema_version": "0.1.0",
    "id": "urn:lex-mx:federal:regulation:reg-lagra-mcdets:term:secretaria",
    "term": "Secretaría",
    "instrument_id": "urn:lex-mx:federal:regulation:reg-lagra-mcdets",
    "defining_provision_id": "urn:lex-mx:federal:regulation:reg-lagra-mcdets:article:2",
    "fraction": "IV",
    "start_char": 157,
    "end_char": 211,
    "basis": "express_definition"
  },
  {
    "schema_version": "0.1.0",
    "id": "urn:lex-mx:federal:regulation:reg-lagra-mcdets:term:procuraduria",
    "term": "Procuraduría",
    "instrument_id": "urn:lex-mx:federal:regulation:reg-lagra-mcdets",
    "defining_provision_id": "urn:lex-mx:federal:regulation:reg-lagra-mcdets:article:2",
    "fraction": "V",
    "start_char": 211,
    "end_char": 256,
    "basis": "express_definition"
  },
  {
    "schema_version": "0.1.0",
    "id": "urn:lex-mx:federal:regulation:reg-lagra-mcdets:term:registro",
    "term": "Registro",
    "instrument_id": "urn:lex-mx:federal:regulation:reg-lagra-mcdets",
    "defining_provision_id": "urn:lex-mx:federal:regulation:reg-lagra-mcdets:article:2",
    "fraction": "VI",
    "start_char": 256,
    "end_char": 299,
    "basis": "express_definition"
  }
]