[
  {
    "schema_version": "0.1.0",
    "id": "urn:lex-mx:federal:regulation:reg-lpesca:term:arte-de-pesca",
    "term": "Arte de pesca",
    "instrument_id": "urn:lex-mx:federal:regulation:reg-lpesca",
    "defining_provision_id": "urn:lex-mx:federal:regulation:reg-lpesca:article:2",
    "fraction": "I",
    "start_char": 55,
    "end_char": 170,
    "basis": "express_definition"
  },
  {
    "schema_version": "0.1.0",
    "id": "urn:lex-mx:federal:regulation:reg-lpesca:term:barco-fabrica",
    "term": "Barco-fábrica",
    "instrument_id": "urn:lex-mx:federal:regulation:reg-lpesca",
    "defining_provision_id": "urn:lex-mx:federal:regulation:reg-lpesca:article:2",
    "fraction": "II",
    "start_char": 170,
    "end_char": 379,
    "basis": "express_definition"
  },
  {
    "schema_version": "0.1.0",
    "id": "urn:lex-mx:federal:regulation:reg-lpesca:term:captura-incidental",
    "term": "Captura incidental",
    "instrument_id": "urn:lex-mx:federal:regulation:reg-lpesca",
    "defining_provision_id": "urn:lex-mx:federal:regulation:reg-lpesca:article:2",
    "fraction": "III",
    "start_char": 379,
    "end_char": 525,
    "basis": "express_definition"
  },
  {
    "schema_version": "0.1.0",
    "id": "urn:lex-mx:federal:regulation:reg-lpesca:term:cuarentena",
    "term": "Cuarentena",
    "instrument_id": "urn:lex-mx:federal:regulation:reg-lpesca",
    "defining_provision_id": "urn:lex-mx:federal:regulation:reg-lpesca:article:2",
    "fraction": "IV",
    "start_char": 525,
    "end_char": 737,
    "basis": "express_definition"
  },
  {
    "schema_version": "0.1.0",
    "id": "urn:lex-mx:federal:regulation:reg-lpesca:term:esfuerzo-pesquero",
    "term": "Esfuerzo pesquero",
    "instrument_id": "urn:lex-mx:federal:regulation:reg-lpesca",
    "defining_provision_id": "urn:lex-mx:federal:regulation:reg-lpesca:article:2",
    "fraction": "V",
    "start_char": 737,
    "end_char": 924,
    "basis": "express_definition"
  },
  {
    "schema_version": "0.1.0",
    "id": "urn:lex-mx:federal:regulation:reg-lpesca:term:ley",
    "term": "Ley",
    "instrument_id": "urn:lex-mx:federal:regulation:reg-lpesca",
    "defining_provision_id": "urn:lex-mx:federal:regulation:reg-lpesca:article:2",
    "fraction": "VI",
    "start_char": 924,
    "end_char": 948,
    "basis": "express_definition"
  },
  {
    "schema_version": "0.1.0",
    "id": "urn:lex-mx:federal:regulation:reg-lpesca:term:metodo-de-pesca",
    "term": "Método de pesca",
    "instrument_id": "urn:lex-mx:federal:regulation:reg-lpesca",
    "defining_provision_id": "urn:lex-mx:federal:regulation:reg-lpesca:article:2",
    "fraction": "VII",
    "start_char": 948,
    "end_char": 1156,
    "basis": "express_definition"
  },
  {
    "schema_version": "0.1.0",
    "id": "urn:lex-mx:federal:regulation:reg-lpesca:term:norma",
    "term": "Norma",
    "instrument_id": "urn:lex-mx:federal:regulation:reg-lpesca",
    "defining_provision_id": "urn:lex-mx:federal:regulation:reg-lpesca:article:2",
    "fraction": "VIII",
    "start_char": 1156,
    "end_char": 1320,
    "basis": "express_definition"
  },
  {
    "schema_version": "0.1.0",
    "id": "urn:lex-mx:federal:regulation:reg-lpesca:term:planta-flotante",
    "term": "Planta flotante",
    "instrument_id": "urn:lex-mx:federal:regulation:reg-lpesca",
    "defining_provision_id": "urn:lex-mx:federal:regulation:reg-lpesca:article:2",
    "fraction": "IX",
    "start_char": 1320,
    "end_char": 1483,
    "basis": "express_definition"
  },
  {
    "schema_version": "0.1.0",
    "id": "urn:lex-mx:federal:regulation:reg-lpesca:term:producto-pesquero",
    "term": "Producto pesquero",
    "instrument_id": "urn:lex-mx:federal:regulation:reg-lpesca",
    "defining_provision_id": "urn:lex-mx:federal:regulation:reg-lpesca:article:2",
    "fraction": "X",
    "start_char": 1483,
    "end_char": 1617,
    "basis": "express_definition"
  },
  {
    "schema_version": "0.1.0",
    "id": "urn:lex-mx:federal:regulation:reg-lpesca:term:puerto-base",
    "term": "Puerto base",
    "instrument_id": "urn:lex-mx:federal:regulation:reg-lpesca",
    "defining_provision_id": "urn:lex-mx:federal:regulation:reg-lpesca:article:2",
    "fraction": "XI",
    "start_char": 1617,
    "end_char": 1738,
    "basis": "express_definition"
  },
  {
    "schema_version": "0.1.0",
    "id": "urn:lex-mx:federal:regulation:reg-lpesca:term:repoblacion",
    "term": "Repoblación",
    "instrument_id": "urn:lex-mx:federal:regulation:reg-lpesca",
    "defining_provision_id": "urn:lex-mx:federal:regulation:reg-lpesca:article:2",
    "fraction": "XII",
    "start_char": 1738,
    "end_char": 1986,
    "basis": "express_definition"
  },
  {
    "schema_version": "0.1.0",
    "id": "urn:lex-mx:federal:regulation:reg-lpesca:term:sanidad-acuicola",
    "term": "Sanidad acuícola",
    "instrument_id": "urn:lex-mx:federal:regulation:reg-lpesca",
    "defining_provision_id": "urn:lex-mx:federal:regulation:reg-lpesca:article:2",
    "fraction": "XIII",
    "start_char": 1986,
    "end_char": 2174,
    "basis": "express_definition"
  },
  {
    "schema_version": "0.1.0",
    "id": "urn:lex-mx:federal:regulation:reg-lpesca:term:secretaria",
    "term": "Secretaría",
    "instrument_id": "urn:lex-mx:federal:regulation:reg-lpesca",
    "defining_provision_id": "urn:lex-mx:federal:regulation:reg-lpesca:article:2",
    "fraction": "XIV",
    "start_char": 2174,
    "end_char": 2253,
    "basis": "express_definition"
  },
  {
    "schema_version": "0.1.0",
    "id": "urn:lex-mx:federal:regulation:reg-lpesca:term:subproducto",
    "term": "Subproducto",
    "instrument_id": "urn:lex-mx:federal:regulation:reg-lpesca",
    "defining_provision_id": "urn:lex-mx:federal:regulation:reg-lpesca:article:2",
    "fraction": "XV",
    "start_char": 2253,
    "end_char": 2360,
    "basis": "express_definition"
  },
  {
    "schema_version": "0.1.0",
    "id": "urn:lex-mx:federal:regulation:reg-lpesca:term:terceros-acreditados-y-aprobados",
    "term": "Terceros acreditados y aprobados",
    "instrument_id": "urn:lex-mx:federal:regulation:reg-lpesca",
    "defining_provision_id": "urn:lex-mx:federal:regulation:reg-lpesca:article:2",
    "fraction": "XVI",
    "start_char": 2360,
    "end_char": 2569,
    "basis": "express_definition"
  },
  {
    "schema_version": "0.1.0",
    "id": "urn:lex-mx:federal:regulation:reg-lpesca:term:unidad-de-cuarentena",
    "term": "Unidad de cuarentena",
    "instrument_id": "urn:lex-mx:federal:regulation:reg-lpesca",
    "defining_provision_id": "urn:lex-mx:federal:regulation:reg-lpesca:article:2",
    "fraction": "XVII",
    "start_char": 2569,
    "end_char": 2763,
    "basis": "express_definition"
  },
  {
    "schema_version": "0.1.0",
    "id": "urn:lex-mx:federal:regulation:reg-lpesca:term:unidad-de-esfuerzo-pesquero",
    "term": "Unidad de esfuerzo pesquero",
    "instrument_id": "urn:lex-mx:federal:regulation:reg-lpesca",
    "defining_provision_id": "urn:lex-mx:federal:regulation:reg-lpesca:article:2",
    "fraction": "XVIII",
    "start_char": 2763,
    "end_char": 3010,
    "basis": "express_definition"
  }
]