[
  {
    "schema_version": "0.1.0",
    "id": "urn:lex-mx:federal:regulation:reg-lsem:term:adscripcion",
    "term": "Adscripción",
    "instrument_id": "urn:lex-mx:federal:regulation:reg-lsem",
    "defining_provision_id": "urn:lex-mx:federal:regulation:reg-lsem:article:2",
    "fraction": "I",
    "start_char": 112,
    "end_char": 301,
    "basis": "express_definition"
  },
  {
    "schema_version": "0.1.0",
    "id": "urn:lex-mx:federal:regulation:reg-lsem:term:jefe-o-titular-de-representacion",
    "term": "Jefe o Titular de Representación",
    "instrument_id": "urn:lex-mx:federal:regulation:reg-lsem",
    "defining_provision_id": "urn:lex-mx:federal:regulation:reg-lsem:article:2",
    "fraction": "II",
    "start_char": 301,
    "end_char": 506,
    "basis": "express_definition"
  },
  {
    "schema_version": "0.1.0",
    "id": "urn:lex-mx:federal:regulation:reg-lsem:term:personal-asimilado",
    "term": "Personal Asimilado",
    "instrument_id": "urn:lex-mx:federal:regulation:reg-lsem",
    "defining_provision_id": "urn:lex-mx:federal:regulation:reg-lsem:article:2",
    "fraction": "III",
    "start_char": 506,
    "end_char": 574,
    "basis": "express_definition"
  },
  {
    "schema_version": "0.1.0",
    "id": "urn:lex-mx:federal:regulation:reg-lsem:term:personal-de-carrera",
    "term": "Personal de Carrera",
    "instrument_id": "urn:lex-mx:federal:regulation:reg-lsem",
    "defining_provision_id": "urn:lex-mx:federal:regulation:reg-lsem:article:2",
    "fraction": "IV",
    "start_char": 574,
    "end_char": 645,
    "basis": "express_definition"
  },
  {
    "schema_version": "0.1.0",
    "id": "urn:lex-mx:federal:regulation:reg-lsem:term:personal-temporal",
    "term": "Personal Temporal",
    "instrument_id": "urn:lex-mx:federal:regulation:reg-lsem",
    "defining_provision_id": "urn:lex-mx:federal:regulation:reg-lsem:article:2",
    "fraction": "V",
    "start_char": 645,
    "end_char": 707,
    "basis": "express_definition"
  }
]