[
  {
    "schema_version": "0.1.0",
    "id": "urn:lex-mx:federal:statute:lgb:term:biblioteca-de-mexico",
    "term": "Biblioteca de México",
    "instrument_id": "urn:lex-mx:federal:statute:lgb",
    "defining_provision_id": "urn:lex-mx:federal:statute:lgb:article:2",
    "fraction": "II",
    "start_char": 324,
    "end_char": 724,
    "basis": "express_definition"
  },
  {
    "schema_version": "0.1.0",
    "id": "urn:lex-mx:federal:statute:lgb:term:biblioteca-del-congreso-de-la-union",
    "term": "Biblioteca del Congreso de la Unión",
    "instrument_id": "urn:lex-mx:federal:statute:lgb",
    "defining_provision_id": "urn:lex-mx:federal:statute:lgb:article:2",
    "fraction": "III",
    "start_char": 724,
    "end_char": 1032,
    "basis": "express_definition"
  },
  {
    "schema_version": "0.1.0",
    "id": "urn:lex-mx:federal:statute:lgb:term:biblioteca-nacional-de-mexico",
    "term": "Biblioteca Nacional de México",
    "instrument_id": "urn:lex-mx:federal:statute:lgb",
    "defining_provision_id": "urn:lex-mx:federal:statute:lgb:article:2",
    "fraction": "IV",
    "start_char": 1032,
    "end_char": 1415,
    "basis": "express_definition"
  },
  {
    "schema_version": "0.1.0",
    "id": "urn:lex-mx:federal:statute:lgb:term:biblioteca-publica",
    "term": "Biblioteca pública",
    "instrument_id": "urn:lex-mx:federal:statute:lgb",
    "defining_provision_id": "urn:lex-mx:federal:statute:lgb:article:2",
    "fraction": "V",
    "start_char": 1415,
    "end_char": 1966,
    "basis": "express_definition"
  },
  {
    "schema_version": "0.1.0",
    "id": "urn:lex-mx:federal:statute:lgb:term:bibliotecario",
    "term": "Bibliotecario",
    "instrument_id": "urn:lex-mx:federal:statute:lgb",
    "defining_provision_id": "urn:lex-mx:federal:statute:lgb:article:2",
    "fraction": "VI",
    "start_char": 1966,
    "end_char": 2094,
    "basis": "express_definition"
  },
  {
    "schema_version": "0.1.0",
    "id": "urn:lex-mx:federal:statute:lgb:term:catalogacion",
    "term": "Catalogación",
    "instrument_id": "urn:lex-mx:federal:statute:lgb",
    "defining_provision_id": "urn:lex-mx:federal:statute:lgb:article:2",
    "fraction": "VII",
    "start_char": 2094,
    "end_char": 2218,
    "basis": "express_definition"
  },
  {
    "schema_version": "0.1.0",
    "id": "urn:lex-mx:federal:statute:lgb:term:catalogo-nacional",
    "term": "Catálogo nacional",
    "instrument_id": "urn:lex-mx:federal:statute:lgb",
    "defining_provision_id": "urn:lex-mx:federal:statute:lgb:article:2",
    "fraction": "VIII",
    "start_char": 2218,
    "end_char": 2448,
    "basis": "express_definition"
  },
  {
    "schema_version": "0.1.0",
    "id": "urn:lex-mx:federal:statute:lgb:term:conservacion",
    "term": "Conservación",
    "instrument_id": "urn:lex-mx:federal:statute:lgb",
    "defining_provision_id": "urn:lex-mx:federal:statute:lgb:article:2",
    "fraction": "IX",
    "start_char": 2448,
    "end_char": 2620,
    "basis": "express_definition"
  },
  {
    "schema_version": "0.1.0",
    "id": "urn:lex-mx:federal:statute:lgb:term:descarte",
    "term": "Descarte",
    "instrument_id": "urn:lex-mx:federal:statute:lgb",
    "defining_provision_id": "urn:lex-mx:federal:statute:lgb:article:2",
    "fraction": "X",
    "start_char": 2620,
    "end_char": 2894,
    "basis": "express_definition"
  },
  {
    "schema_version": "0.1.0",
    "id": "urn:lex-mx:federal:statute:lgb:term:direccion-general",
    "term": "Dirección General",
    "instrument_id": "urn:lex-mx:federal:statute:lgb",
    "defining_provision_id": "urn:lex-mx:federal:statute:lgb:article:2",
    "fraction": "XI",
    "start_char": 2894,
    "end_char": 3001,
    "basis": "express_definition"
  },
  {
    "schema_version": "0.1.0",
    "id": "urn:lex-mx:federal:statute:lgb:term:infraestructura-bibliotecaria",
    "term": "Infraestructura bibliotecaria",
    "instrument_id": "urn:lex-mx:federal:statute:lgb",
    "defining_provision_id": "urn:lex-mx:federal:statute:lgb:article:2",
    "fraction": "XII",
    "start_char": 3001,
    "end_char": 3289,
    "basis": "express_definition"
  },
  {
    "schema_version": "0.1.0",
    "id": "urn:lex-mx:federal:statute:lgb:term:libro",
    "term": "Libro",
    "instrument_id": "urn:lex-mx:federal:statute:lgb",
    "defining_provision_id": "urn:lex-mx:federal:statute:lgb:article:2",
    "fraction": "XIV",
    "start_char": 3289,
    "end_char": 3831,
    "basis": "express_definition"
  },
  {
    "schema_version": "0.1.0",
    "id": "urn:lex-mx:federal:statute:lgb:term:preservacion",
    "term": "Preservación",
    "instrument_id": "urn:lex-mx:federal:statute:lgb",
    "defining_provision_id": "urn:lex-mx:federal:statute:lgb:article:2",
    "fraction": "XV",
    "start_char": 3831,
    "end_char": 4051,
    "basis": "express_definition"
  },
  {
    "schema_version": "0.1.0",
    "id": "urn:lex-mx:federal:statute:lgb:term:publicacion-electronica",
    "term": "Publicación electrónica",
    "instrument_id": "urn:lex-mx:federal:statute:lgb",
    "defining_provision_id": "urn:lex-mx:federal:statute:lgb:article:2",
    "fraction": "XVI",
    "start_char": 4051,
    "end_char": 4538,
    "basis": "express_definition"
  },
  {
    "schema_version": "0.1.0",
    "id": "urn:lex-mx:federal:statute:lgb:term:publicacion-periodica",
    "term": "Publicación periódica",
    "instrument_id": "urn:lex-mx:federal:statute:lgb",
    "defining_provision_id": "urn:lex-mx:federal:statute:lgb:article:2",
    "fraction": "XVII",
    "start_char": 4538,
    "end_char": 4830,
    "basis": "express_definition"
  },
  {
    "schema_version": "0.1.0",
    "id": "urn:lex-mx:federal:statute:lgb:term:red",
    "term": "Red",
    "instrument_id": "urn:lex-mx:federal:statute:lgb",
    "defining_provision_id": "urn:lex-mx:federal:statute:lgb:article:2",
    "fraction": "XVIII",
    "start_char": 4830,
    "end_char": 4881,
    "basis": "express_definition"
  },
  {
    "schema_version": "0.1.0",
    "id": "urn:lex-mx:federal:statute:lgb:term:red-estatal",
    "term": "Red Estatal",
    "instrument_id": "urn:lex-mx:federal:statute:lgb",
    "defining_provision_id": "urn:lex-mx:federal:statute:lgb:article:2",
    "fraction": "XIX",
    "start_char": 4881,
    "end_char": 5010,
    "basis": "express_definition"
  },
  {
    "schema_version": "0.1.0",
    "id": "urn:lex-mx:federal:statute:lgb:term:red-nacional-de-bibliotecas-publicas",
    "term": "Red Nacional de Bibliotecas Públicas",
    "instrument_id": "urn:lex-mx:federal:statute:lgb",
    "defining_provision_id": "urn:lex-mx:federal:statute:lgb:article:2",
    "fraction": "XX",
    "start_char": 5010,
    "end_char": 5346,
    "basis": "express_definition"
  },
  {
    "schema_version": "0.1.0",
    "id": "urn:lex-mx:federal:statute:lgb:term:secretaria",
    "term": "Secretaría",
    "instrument_id": "urn:lex-mx:federal:statute:lgb",
    "defining_provision_id": "urn:lex-mx:federal:statute:lgb:article:2",
    "fraction": "XXI",
    "start_char": 5346,
    "end_char": 5408,
    "basis": "express_definition"
  },
  {
    "schema_version": "0.1.0",
    "id": "urn:lex-mx:federal:statute:lgb:term:servicios-bibliotecarios",
    "term": "Servicios bibliotecarios",
    "instrument_id": "urn:lex-mx:federal:statute:lgb",
    "defining_provision_id": "urn:lex-mx:federal:statute:lgb:article:2",
    "fraction": "XXII",
    "start_char": 5408,
    "end_char": 5649,
    "basis": "express_definition"
  },
  {
    "schema_version": "0.1.0",
    "id": "urn:lex-mx:federal:statute:lgb:term:sistema",
    "term": "Sistema",
    "instrument_id": "urn:lex-mx:federal:statute:lgb",
    "defining_provision_id": "urn:lex-mx:federal:statute:lgb:article:2",
    "fraction": "XXIII",
    "start_char": 5649,
    "end_char": 5699,
    "basis": "express_definition"
  },
  {
    "schema_version": "0.1.0",
    "id": "urn:lex-mx:federal:statute:lgb:term:sistema-nacional-de-bibliotecas",
    "term": "Sistema Nacional de Bibliotecas",
    "instrument_id": "urn:lex-mx:federal:statute:lgb",
    "defining_provision_id": "urn:lex-mx:federal:statute:lgb:article:2",
    "fraction": "XXIV",
    "start_char": 5699,
    "end_char": 6075,
    "basis": "express_definition"
  },
  {
    "schema_version": "0.1.0",
    "id": "urn:lex-mx:federal:statute:lgb:term:sitio-web",
    "term": "Sitio web",
    "instrument_id": "urn:lex-mx:federal:statute:lgb",
    "defining_provision_id": "urn:lex-mx:federal:statute:lgb:article:2",
    "fraction": "XXV",
    "start_char": 6075,
    "end_char": 6203,
    "basis": "express_definition"
  },
  {
    "schema_version": "0.1.0",
    "id": "urn:lex-mx:federal:statute:lgb:term:soporte-no-tangible",
    "term": "Soporte no tangible",
    "instrument_id": "urn:lex-mx:federal:statute:lgb",
    "defining_provision_id": "urn:lex-mx:federal:statute:lgb:article:2",
    "fraction": "XXVI",
    "start_char": 6203,
    "end_char": 6396,
    "basis": "express_definition"
  }
]