[
  {
    "schema_version": "0.1.0",
    "id": "urn:lex-mx:federal:regulation:reg-larcp:term:ley",
    "term": "Ley",
    "instrument_id": "urn:lex-mx:federal:regulation:reg-larcp",
    "defining_provision_id": "urn:lex-mx:federal:regulation:reg-larcp:article:2",
    "fraction": "I",
    "start_char": 55,
    "end_char": 115,
    "basis": "express_definition"
  },
  {
    "schema_version": "0.1.0",
    "id": "urn:lex-mx:federal:regulation:reg-larcp:term:reglamento",
    "term": "Reglamento",
    "instrument_id": "urn:lex-mx:federal:regulation:reg-larcp",
    "defining_provision_id": "urn:lex-mx:federal:regulation:reg-larcp:article:2",
    "fraction": "II",
    "start_char": 115,
    "end_char": 200,
    "basis": "express_definition"
  },
  {
    "schema_version": "0.1.0",
    "id": "urn:lex-mx:federal:regulation:reg-larcp:term:secretaria",
    "term": "Secretaría",
    "instrument_id": "urn:lex-mx:federal:regulation:reg-larcp",
    "defining_provision_id": "urn:lex-mx:federal:regulation:reg-larcp:article:2",
    "fraction": "III",
    "start_char": 200,
    "end_char": 248,
    "basis": "express_definition"
  },
  {
    "schema_version": "0.1.0",
    "id": "urn:lex-mx:federal:regulation:reg-larcp:term:subsecretaria",
    "term": "Subsecretaría",
    "instrument_id": "urn:lex-mx:federal:regulation:reg-larcp",
    "defining_provision_id": "urn:lex-mx:federal:regulation:reg-larcp:article:2",
    "fraction": "IV",
    "start_char": 248,
    "end_char": 333,
    "basis": "express_definition"
  },
  {
    "schema_version": "0.1.0",
    "id": "urn:lex-mx:federal:regulation:reg-larcp:term:direccion-general",
    "term": "Dirección General",
    "instrument_id": "urn:lex-mx:federal:regulation:reg-larcp",
    "defining_provision_id": "urn:lex-mx:federal:regulation:reg-larcp:article:2",
    "fraction": "V",
    "start_char": 333,
    "end_char": 403,
    "basis": "express_definition"
  }
]